265,POLK,100121,BARTOW REGIONAL MEDICAL CENTER,53,2,3.64%,55,"BARTOW REGIONAL MEDICAL CENTER, Bartow Regional Medical Center, BARTOW REGIONAL MEDICAL CENTER",90.00000762939453,2333831.0,POLK
266,POLK,100137,ADVENTHEALTH HEART OF FLORIDA,123,69,35.94%,192,"HEART OF FLORIDA REGIONAL MEDICAL CENTER, AdventHealth Heart of Florida (FKA Heart of Florida Regional Medical Center), ",90.00000762939453,16833837.0,POLK
267,POLK,100157,LAKELAND REGIONAL MEDICAL CENTER,809,72,8.17%,881,"LAKELAND REGIONAL MEDICAL CENTER, Lakeland Regional Health Medical Center, LAKELAND REGIONAL MED CTR",90.00000762939453,21433805.0,POLK
268,POLK,120010,WINTER HAVEN WOMEN'S HOSPITAL,36,5,12.20%,41,"WINTER HAVEN WOMEN'S HOSPITAL, , ",95.08197784423828,32533880.0,POLK
269,PUTNAM,100232,PUTNAM COMMUNITY MEDICAL CENTER,66,18,21.43%,84,"PUTNAM COMMUNITY MEDICAL CENTER, Putnam Community Medical Center, ",90.00000762939453,32232177.0,PUTNAM
270,SANTA ROSA,100048,JAY HOSPITAL,11,10,47.62%,21,"JAY HOSPITAL, Jay Hospital, JAY HOSPITAL",90.00000762939453,19032565.0,SANTA ROSA
271,SANTA ROSA,100124,SANTA ROSA MEDICAL CENTER,70,80,53.33%,150,"SANTA ROSA MEDICAL CENTER, Santa Rosa Medical Center, SANTA ROSA MEDICAL CENTER",90.00000762939453,33632570.0,SANTA ROSA
272,SANTA ROSA,104027,WEST FLORIDA COMMUNITY CARE CENTER,24,76,76.00%,100,"WEST FLORIDA COMMUNITY CARE CENTER, West Florida Community Care Center, WEST FLORIDA COMM. CARE CENTER",90.00000762939453,42132570.0,SANTA ROSA
273,SANTA ROSA,110003,GULF BREEZE HOSPITAL,52,25,32.47%,77,"GULF BREEZE HOSPITAL, Gulf Breeze Hospital, GULF BREEZE HOSPITAL",90.00000762939453,14332561.0,SANTA ROSA
274,SARASOTA,100070,VENICE REGIONAL BAYFRONT HEALTH,129,101,43.91%,230,"VENICE REGIONAL MEDICAL CENTER, Venice Regional Bayfront Health (FKA Venice Regional Medical Center), VENICE REGIONAL MEDICAL CENTER",90.00000762939453,41334285.0,SARASOTA
275,SARASOTA,100087,SARASOTA MEMORIAL HOSPITAL,699,14,1.96%,713,"SARASOTA MEMORIAL HOSPITAL, Sarasota Memorial Hospital, SARASOTA MEMORIAL HOSPITAL",90.00000762939453,33734239.0,SARASOTA
276,SARASOTA,100166,DOCTORS HOSPITAL OF SARASOTA,106,40,27.40%,146,"DOCTORS HOSPITAL OF SARASOTA, Doctors Hospital of Sarasota, DOCTORS HOSPITAL OF SARASOTA",90.00000762939453,7834233.0,SARASOTA
277,SARASOTA,110004,ENGLEWOOD COMMUNITY HOSPITAL,42,33,44.00%,75,"ENGLEWOOD COMMUNITY HOSPITAL, Englewood Community Hospital, ENGLEWOOD COMMUNITY HOSPITAL",90.00000762939453,9434223.0,SARASOTA
278,SARASOTA,110013,ENCOMPASS HEALTH REHABILITATION HOSPITAL OF SARASOTA,77,13,14.44%,90,"HEALTHSOUTH REHABILITATION HOSPITAL OF SARASOTA, Encompass Health Rehabilitation Hospital of Sarasota (FKA Healthsouth Rehab Hospital of Sarasota), ENCOMPASS HEALTH REHABILITATION HOSP",90.00000762939453,16234240.0,SARASOTA
279,SARASOTA,23960049,PAM SPECIALTY HOSPITAL OF SARASOTA,35,5,12.50%,40,"COMPLEX CARE HOSPITAL AT RIDGELAKE, PAM Specialty Hospital of Sarasota (FKA Complex Care Hospital at Ridgelake), COMPLEX CARE HOSPITAL AT RIDGELAKE",90.00000762939453,6934240.0,SARASOTA
280,SEMINOLE,100161,CENTRAL FLORIDA REGIONAL HOSPITAL,187,21,10.10%,208,"CENTRAL FLORIDA REGIONAL HOSPITAL, Central Florida Regional Hospital, CENTRAL FLORIDA REGIONAL HOSPITAL",90.00000762939453,6232771.0,SEMINOLE
281,SEMINOLE,100263,ORLANDO HEALTH SOUTH SEMINOLE HOSPITAL,221,31,12.30%,252,"HEALTHSOUTH REHABILITATION HOSPITAL OF ALTAMONTE SPRINGS, Encompass Health Rehabilitation Hospital of Altamonte Springs (FKA HealthSouth Rehabilitation Hospital of Altamonte Springs), ENCOMPASS HEALTH REHABILITATION HOSP",85.50000762939453,35632714.0,SEMINOLE
282,SEMINOLE,120004,ADVENTHEALTH ALTAMONTE SPRINGS,306,87,22.14%,393,"HEALTHSOUTH REHABILITATION HOSPITAL OF ALTAMONTE SPRINGS, Encompass Health Rehabilitation Hospital of Altamonte Springs (FKA HealthSouth Rehabilitation Hospital of Altamonte Springs), ENCOMPASS HEALTH REHABILITATION HOSP",85.50000762939453,35632714.0,SEMINOLE
283,SEMINOLE,23960115,ENCOMPASS HEALTH REHABILITATION HOSPITAL OF ALTAMONTE SPRINGS,55,5,8.33%,60,"HEALTHSOUTH REHABILITATION HOSPITAL OF ALTAMONTE SPRINGS, Encompass Health Rehabilitation Hospital of Altamonte Springs (FKA HealthSouth Rehabilitation Hospital of Altamonte Springs), ENCOMPASS HEALTH REHABILITATION HOSP",90.00000762939453,35632714.0,SEMINOLE
284,SEMINOLE,23960121,OVIEDO MEDICAL CENTER,54,10,15.63%,64,"OVIEDO MEDICAL CENTER, Oviedo Medical Center, OVIEDO MEDICAL CENTER",90.00000762939453,178432765.0,SEMINOLE
285,ST. JOHNS,100219,FLAGLER HOSPITAL,197,135,40.66%,332,"FLAGLER HOSPITAL, Flagler Health (AKA Flagler Hospital), FLAGLER HOSPITAL",90.00000762939453,9832086.0,ST. JOHNS
286,ST. LUCIE,100246,LAWNWOOD REGIONAL MEDICAL CENTER & HEART INSTITUTE,378,37,8.92%,415,"LAWNWOOD REGIONAL MEDICAL CENTER & HEART, Lawnwood Regional Medical Center & Heart Institute, LAWNWOOD REGIONAL MEDICAL CENTER",90.00000762939453,22134950.0,ST. LUCIE
287,ST. LUCIE,100260,ST LUCIE MEDICAL CENTER,200,29,12.66%,229,"ST LUCIE MEDICAL CENTER, St Lucie Medical Center, ST. LUCIE MEDICAL CENTER",90.00000762939453,39034952.0,ST. LUCIE
288,ST. LUCIE,110022,PORT ST LUCIE HOSPITAL,59,16,21.33%,75,"PORT ST LUCIE HOSPITAL, Port St Lucie Hospital, PORT ST LUCIE HOSPITAL",90.00000762939453,31934952.0,ST. LUCIE
289,ST. LUCIE,23960108,CLEVELAND CLINIC TRADITION HOSPITAL,152,25,14.12%,177,"TRADITION MEDICAL CENTER, Cleveland Clinic Tradition Hospital (FKA Tradition Medical Center), ",90.00000762939453,36434987.0,ST. LUCIE
290,SUMTER,23960032,UF HEALTH THE VILLAGES HOSPITAL,195,112,36.48%,307,"VILLAGES REGIONAL HOSPITAL, THE, UF Health the Villages Hospital (FKA the Villages Regional Hospital), THE VILLAGES REGIONAL HOSPITAL",90.00000762939453,41632159.0,SUMTER
291,SUMTER,23960086,SELECT SPECIALTY HOSPITAL-THE VILLAGES INC,31,9,22.50%,40,"PROMISE HOSPITAL OF FLORIDA AT THE VILLAGES, Select Specialty Hospital - The Villages (FKA Promise Hospital of Florida at the Villages), SSH - THE VILLAGES",85.50000762939453,32034484.0,SUMTER
292,SUWANNEE,100146,LAKE CITY MEDICAL CENTER SUWANNEE CAMPUS,0,0,,0,"SHANDS LIVE OAK REGIONAL MEDICAL CENTER, Shands Live Oak Regional Medical Center, LIVE OAK SHANDS",85.50000762939453,35732060.0,SUWANNEE
293,TAYLOR,100106,DOCTORS' MEMORIAL HOSPITAL,9,7,43.75%,16,"DOCTORS MEMORIAL HOSPITAL, Doctors Memorial Hospital, DOCTORS MEMORIAL",86.5384750366211,8232348.0,TAYLOR
294,UNION,100241,LAKE BUTLER HOSPITAL,5,20,80.00%,25,"LAKE BUTLER HOSPITAL HAND SURGERY CENTER, Lake Butler Hospital (FKA Lake Butler Hand Surgery Center), LAKE BUTLER HOSPITAL",90.00000762939453,20832054.0,UNION
295,UNION,110183,RECEPTION AND MEDICAL CENTER HOSPITAL,49,55,52.88%,104,"RECEPTION AND MEDICAL CENTER HOSPITAL, Reception and Medical Center, ",90.00000762939453,32432054.0,UNION
296,VOLUSIA,100014,ADVENTHEALTH NEW SMYRNA BEACH,77,32,29.36%,109,"FLORIDA HOSPITAL NEW SMYRNA, AdventHealth New Smyrna Beach (FKA Florida Hospital New Smyrna), ADVENTHEALTH NEW SMYRNA BEACH",90.00000762939453,3232168.0,VOLUSIA
297,VOLUSIA,100017,HALIFAX HEALTH MEDICAL CENTER,378,155,29.08%,533,"HALIFAX HEALTH MEDICAL CENTER, Halifax Health Medical Center of Daytona Beach, HALIFAX MEDICAL CENTER",90.00000762939453,15132114.0,VOLUSIA
298,VOLUSIA,100045,ADVENTHEALTH DELAND,102,62,37.80%,164,"FLORIDA HOSPITAL DELAND, AdventHealth DeLand (FKA Florida Hospital DeLand), ADVENTHEALTH DELAND",90.00000762939453,11532721.0,VOLUSIA
299,VOLUSIA,100072,ADVENTHEALTH FISH MEMORIAL,147,42,22.22%,189,"FLORIDA HOSPITAL FISH MEMORIAL, AdventHealth Fish Memorial (FKA Florida Hospital Fish Memorial), ADVENTHEALTH FISH MEMORIAL",90.00000762939453,11932763.0,VOLUSIA
300,VOLUSIA,100169,ADVENTHEALTH DAYTONA BEACH,230,92,28.57%,322,"FLORIDA HOSPITAL MEMORIAL MEDICAL CENTER, AdventHealth Daytona Beach (FKA Florida Hospital Memorial Medical Center), ADVENTHEALTH DAYTONA BEACH -AMENDED",90.00000762939453,12732117.0,VOLUSIA
301,VOLUSIA,110016,HALIFAX PSYCHIATRIC CENTER-NORTH,13,19,59.38%,32,"HALIFAX PSYCHIATRIC CENTER-NORTH, , ",95.52239990234375,15432117.0,VOLUSIA
302,VOLUSIA,23960051,HALIFAX HEALTH MEDICAL CENTER- PORT ORANGE,38,27,41.54%,65,"HALIFAX HEALTH MEDICAL CENTER- PORT ORANGE, , ",96.5517349243164,15332127.0,VOLUSIA
303,VOLUSIA,23960120,SELECT SPECIALTY HOSPITAL - DAYTONA BEACH,28,6,17.65%,34,"SELECT SPECIALTY HOSPITAL - DAYTONA BEACH, Select Specialty Hospital - Daytona Beach, SSH - DAYTONA BEACH",90.00000762939453,35832117.0,VOLUSIA
304,VOLUSIA,23960152,HALIFAX HEALTH UF HEALTH MEDICAL CENTER OF DELTONA,35,38,52.05%,73,"FLORIDA HOSPITAL MEMORIAL MEDICAL CENTER, AdventHealth Daytona Beach (FKA Florida Hospital Memorial Medical Center), ADVENTHEALTH DAYTONA BEACH -AMENDED",85.50000762939453,12732117.0,VOLUSIA
305,WALTON,100081,HEALTHMARK REGIONAL MEDICAL CENTER,4,9,69.23%,13,"HEALTHMARK REGIONAL MEDICAL CENTER, Healthmark Regional Medical Center, HEALTHMARK REGIONAL MED CTR",90.00000762939453,15632435.0,WALTON
306,WALTON,23960041,ASCENSION SACRED HEART EMERALD COAST,69,35,33.65%,104,"SACRED HEART HOSPITAL ON EMERALD COAST, Ascension Sacred Heart Hospital on the Emerald Coast, SACRED HEART HOSPITAL ON THE EMERALD",85.50000762939453,33132550.0,WALTON
307,WASHINGTON,100147,NORTHWEST FLORIDA COMMUNITY HOSPITAL,45,14,23.73%,59,"NORTHWEST FLORIDA COMMUNITY HOSPITAL, Northwest Florida Community Hospital, NORTHWEST FLORIDA COMMUNITY HOSPITAL",90.00000762939453,28732428.0,WASHINGTON
