,County,FileNumber,ProviderName,Bed Census,Available,Available Capacity,Total Staffed Bed Capacity,Matched Name,Matched Score,CCM_ID,CCM County
1,ALACHUA,100113,UF HEALTH SHANDS HOSPITAL,859,187,17.88%,1046,"SHANDS HOSPITAL, UF Health Shands Hospital (FKA Shands at the University of Florida), UF HEALTH SHANDS",90.00000762939453,35032610.0,ALACHUA
2,ALACHUA,100204,NORTH FLORIDA REGIONAL MEDICAL CENTER,366,58,13.68%,424,"NORTH FLORIDA REGIONAL MEDICAL CENTER, North Florida Regional Medical Center, NORTH FLORIDA REGIONAL MED CTR",90.00000762939453,27832605.0,ALACHUA
3,ALACHUA,110025,UF HEALTH REHAB HOSPITAL,40,10,20.00%,50,"SELECT SPECIALTY HOSPITAL GAINESVILLE, UF Health Rehab Hospital, ",90.00000762939453,34132608.0,ALACHUA
4,ALACHUA,120011,UF HEALTH SHANDS PSYCHIATRIC HOSPITAL,55,26,32.10%,81,"MALCOM RANDALL VA MEDICAL CENTER, North Florida/South Georgia Veterans Health System - Malcom Randall VA Medical Center, ",85.50000762939453,23132608.0,ALACHUA
5,ALACHUA,23960071,SELECT SPECIALTY HOSPITAL GAINESVILLE,42,6,12.50%,48,"SELECT SPECIALTY HOSPITAL GAINESVILLE, UF Health Rehab Hospital, ",90.00000762939453,34132608.0,ALACHUA
6,BAKER,100134,ED FRASER MEMORIAL HOSPITAL,2,10,83.33%,12,"ED FRASER MEMORIAL HOSPITAL, Baker County Medical Services (FKA Ed Fraser Memorial Hospital), ED FRASER MEMORIAL HOSPITAL",90.00000762939453,8832063.0,BAKER
7,BAKER,104007,NORTHEAST FLORIDA STATE HOSPITAL,508,105,17.13%,613,"NORTHEAST FLORIDA STATE HOSPITAL, Northeast Florida State Hospital, NORTHEAST FLORIDA STATE HOSPITAL",90.00000762939453,28432063.0,BAKER
8,BAY,100026,ASCENSION SACRED HEART BAY,128,40,23.81%,168,"BAY MEDICAL CENTER SACRED HEART, Ascension Sacred Heart Hospital Bay (AKA Bay Medical Sacred Heart), BAY COUNTY HEALTH SYSTEM LLC",85.50000762939453,2632401.0,BAY
9,BAY,100242,GULF COAST REGIONAL MEDICAL CENTER,205,34,14.23%,239,"GULF COAST MEDICAL CENTER, Gulf Coast Regional Medical Center, GULF COAST REGIONAL MED CTR",90.00000762939453,14632405.0,BAY
10,BAY,110034,EMERALD COAST BEHAVIORAL HOSPITAL,56,30,34.88%,86,"EMERALD COAST BEHAVIORAL HOSPITAL, Emerald Coast Behavioral Hospital, EMERALD COAST BEHAVIORAL HOSPITAL",90.00000762939453,9132405.0,BAY
11,BAY,23960013,ENCOMPASS HEALTH REHABILITATION HOSPITAL OF PANAMA CITY,41,15,26.79%,56,"HEALTHSOUTH EMERALD COAST REHABILITATION, Encompass Health Rehabilitation Hospital of Panama City (FKA Healthsouth Emerald Coast Rehabilitation Hospital), ENCOMPASS HEALTH REHABILITATION HOSP",90.00000762939453,15932405.0,BAY
12,BAY,23960045,SELECT SPECIALTY HOSPITAL - PANAMA CITY,2,28,93.33%,30,"SELECT SPECIALTY HOSPITAL - PANAMA CITY, , SSH - PANAMA CITY  INC",90.00000762939453,34532401.0,BAY
13,BRADFORD,100103,NORTH FLORIDA REGIONAL MEDICAL CENTER STARKE CAMPUS,5,5,50.00%,10,"SHANDS STARKE REGIONAL MEDICAL CENTER, Shands Starke Regional Medical Center, SHANDS STARKE",85.50000762939453,35932091.0,BRADFORD
14,BREVARD,100019,HOLMES REGIONAL MEDICAL CENTER,405,101,19.96%,506,"HOLMES REGIONAL MEDICAL CENTER, Holmes Regional Medical Center, HOLMES REGL MEDICAL CENTER",90.00000762939453,17432901.0,BREVARD
15,BREVARD,100028,PARRISH MEDICAL CENTER,99,54,35.29%,153,"PARRISH MEDICAL CENTER, Parrish Medical Center (AKA Parrish Healthcare), PARRISH MEDICAL CENTER",90.00000762939453,30932796.0,BREVARD
16,BREVARD,100092,ROCKLEDGE REGIONAL MEDICAL CENTER,130,90,40.91%,220,"WUESTHOFF MEDICAL CENTER-ROCKLEDGE, Rockledge Regional Medical Center (FKA Wuesthoff Medical Center - Rockledge), WUESTOFF MEDICAL CENTER - ROCKLEDGE",90.00000762939453,44032955.0,BREVARD
17,BREVARD,100177,CAPE CANAVERAL HOSPITAL,79,61,43.57%,140,"CAPE CANAVERAL HOSPITAL, Cape Canaveral Hospital, CAPE CANAVERAL HOSPITAL INC",90.00000762939453,5432931.0,BREVARD
18,BREVARD,104024,"CIRCLES OF CARE, INC",32,20,38.46%,52,"VIERA HOSPITAL, Viera Hospital, VIERA HOSPITAL INC",85.50000762939453,41532940.0,BREVARD
19,BREVARD,110027,SEA PINES REHABILITATION HOSPITAL AFFILIATE OF ENCOMPASS HEALTH,59,1,1.67%,60,"HEALTHSOUTH SEA PINES REHABILITATION HOSPITAL, Sea Pines Rehabilitation Hospital (FKA Healthsouth Sea Pines Rehab Hospital), SEA PINES REHABILITATION HOSPITAL  A",85.50000762939453,16532901.0,BREVARD
20,BREVARD,110036,DEVEREUX FLORIDA,100,0,0.00%,100,"DEVEREUX HOSPITAL AND CHILDREN'S CENTER OF FLORIDA, , ",85.50000762939453,7532940.0,BREVARD
21,BREVARD,120007,PALM BAY HOSPITAL,92,23,20.00%,115,"PALM BAY HOSPITAL, Palm Bay Hospital, PALM BAY HOSPITAL",90.00000762939453,29932907.0,BREVARD
22,BREVARD,23960034,MELBOURNE REGIONAL MEDICAL CENTER,35,70,66.67%,105,"WUESTHOFF MEDICAL CENTER-MELBOURNE, Melbourne Regional Medical Center (FKA Wuesthoff Medical Center - Melbourne), WUESTHOFF MEDICAL CENTER - MELBOURNE",90.00000762939453,43932935.0,BREVARD
23,BREVARD,23960090,KINDRED HOSPITAL MELBOURNE,38,22,36.67%,60,"KINDRED HOSPITAL MELBOURNE, Kindred Hospital Melbourne, ",90.00000762939453,19732901.0,BREVARD
24,BREVARD,23960092,VIERA HOSPITAL,75,9,10.71%,84,"VIERA HOSPITAL, Viera Hospital, VIERA HOSPITAL INC",90.00000762939453,41532940.0,BREVARD
25,BREVARD,23960153,PALM POINT BEHAVIORAL HEALTH,30,14,31.82%,44,"PALM BAY HOSPITAL, Palm Bay Hospital, PALM BAY HOSPITAL",85.50000762939453,29932907.0,BREVARD
26,BROWARD,100038,MEMORIAL REGIONAL HOSPITAL,633,134,17.47%,767,"MEMORIAL REGIONAL HOSPITAL SOUTH, , ",95.00000762939453,26133021.0,BROWARD
27,BROWARD,100039,BROWARD HEALTH MEDICAL CENTER,432,32,6.90%,464,"BROWARD HEALTH MEDICAL CENTER, Broward Health Medical Center (FKA Broward General Medical Center), BROWARD HEALTH MEDICAL CENTER",90.00000762939453,4633316.0,BROWARD
28,BROWARD,100042,KINDRED HOSPITAL-SOUTH FLORIDA-HOLLYWOOD,76,43,36.13%,119,"KINDRED HOSPITAL-SOUTH FLORIDA-HOLLYWOOD, , ",96.38555145263672,20633020.0,BROWARD
29,BROWARD,100056,CLEVELAND CLINIC HOSPITAL,209,21,9.13%,230,"CLEVELAND CLINIC HOSPITAL, Cleveland Clinic Florida, CCF HOSPITAL - WESTON",90.00000762939453,6733326.0,BROWARD
30,BROWARD,100073,HOLY CROSS HOSPITAL,247,101,29.02%,348,"HOLY CROSS HOSPITAL, Holy Cross Hospital, ",90.00000762939453,17533308.0,BROWARD
31,BROWARD,100086,BROWARD HEALTH NORTH,235,0,0.00%,235,"BROWARD HEALTH NORTH, Broward Health North (FKA North Broward Medical Center), BROWARD HEALTH NORTH",90.00000762939453,4833064.0,BROWARD
32,BROWARD,100120,KINDRED HOSPITAL-SOUTH FLORIDA-FT LAUDERDALE,43,11,20.37%,54,"KINDRED HOSPITAL-SOUTH FLORIDA-FT LAUDERDALE, Kindred Hospital - South Florida Ft Lauderdale, KINDRED HOSPITAL SOUTH FLORIDA",90.00000762939453,20533301.0,BROWARD
33,BROWARD,100167,PLANTATION GENERAL HOSPITAL,151,113,42.80%,264,"PLANTATION GENERAL HOSPITAL, Plantation General Hospital, ",90.00000762939453,31733317.0,BROWARD
34,BROWARD,100189,NORTHWEST MEDICAL CENTER,205,79,27.82%,284,"NORTHWEST MEDICAL CENTER, Northwest Medical Center, NORTHWEST MEDICAL CENTER",90.00000762939453,28833063.0,BROWARD
35,BROWARD,100200,BROWARD HEALTH IMPERIAL POINT,97,42,30.22%,139,"BROWARD HEALTH IMPERIAL POINT, Broward Health Imperial Point (FKA Imperial Point Medical Center), BROWARD HEALTH IMPERIAL POINT",90.00000762939453,4433308.0,BROWARD
36,BROWARD,100210,FLORIDA MEDICAL CENTER - A CAMPUS OF NORTH SHORE,172,26,13.13%,198,"HEALTHSOUTH SUNRISE REHABILITATION HOSPITAL, Encompass Health Rehabilitation Hospital of Sunrise (FKA Healthsouth Sunrise Rehab Hospital), ENCOMPASS HEALTH REHABILITATION HOSP",85.50000762939453,16633351.0,BROWARD
37,BROWARD,100224,UNIVERSITY HOSPITAL AND MEDICAL CENTER,183,134,42.27%,317,"UNIVERSITY HOSPITAL AND MEDICAL CENTER, University Hospital & Medical Center, UNIVERSITY HOSPITAL",90.00000762939453,40933321.0,BROWARD
38,BROWARD,100225,MEMORIAL REGIONAL HOSPITAL SOUTH,106,28,20.90%,134,"MEMORIAL REGIONAL HOSPITAL SOUTH, , ",95.52239990234375,26133021.0,BROWARD
39,BROWARD,100228,WESTSIDE REGIONAL MEDICAL CENTER,238,12,4.80%,250,"WESTSIDE REGIONAL MEDICAL CENTER, Westside Regional Medical Center, WESTSIDE REGIONAL MEDICAL CENTER",90.00000762939453,43133324.0,BROWARD
40,BROWARD,100230,MEMORIAL HOSPITAL PEMBROKE,159,15,8.62%,174,"MEMORIAL HOSPITAL PEMBROKE, Memorial Hospital Pembroke, MEMORIAL HOSPITAL PEMBROKE",90.00000762939453,25633024.0,BROWARD
41,BROWARD,103027,ST ANTHONY'S REHABILITATION HOSPITAL,11,15,57.69%,26,"ST ANTHONY'S REHABILITATION HOSPITAL, St Anthonys Rehabilitation Hospital, ",90.00000762939453,38033311.0,BROWARD
42,BROWARD,103028,ENCOMPASS HEALTH REHABILITATION HOSPITAL OF SUNRISE,80,30,27.27%,110,"HEALTHSOUTH SUNRISE REHABILITATION HOSPITAL, Encompass Health Rehabilitation Hospital of Sunrise (FKA Healthsouth Sunrise Rehab Hospital), ENCOMPASS HEALTH REHABILITATION HOSP",90.00000762939453,16633351.0,BROWARD
43,BROWARD,104001,SOUTH FLORIDA STATE HOSPITAL,297,0,0.00%,297,"SOUTH FLORIDA STATE HOSPITAL, South Florida State Hospital, SOUTH FLORIDA STATE HOSPITAL",90.00000762939453,36733025.0,BROWARD
44,BROWARD,104015,LARKIN COMMUNITY HOSPITAL BEHAVIORAL HEALTH SERVICES,15,25,62.50%,40,"LARKIN COMMUNITY HOSPITAL BEHAVIORAL HEALTH SERVICES, Larkin Community Hospital - Behavioral Health Services, LARKIN COMMUNITY HOSPITAL BEHAVIORAL",90.00000762939453,17333021.0,BROWARD
45,BROWARD,104026,FORT LAUDERDALE BEHAVIORAL HEALTH CENTER,92,0,0.00%,92,"HEALTHSOUTH SUNRISE REHABILITATION HOSPITAL, Encompass Health Rehabilitation Hospital of Sunrise (FKA Healthsouth Sunrise Rehab Hospital), ENCOMPASS HEALTH REHABILITATION HOSP",85.50000762939453,16633351.0,BROWARD
46,BROWARD,110019,BROWARD HEALTH CORAL SPRINGS,178,20,10.10%,198,"BROWARD HEALTH CORAL SPRINGS, Broward Health Coral Springs (FKA Coral Springs Medical Center), BROWARD HEALTH CORAL SPRINGS",90.00000762939453,4233065.0,BROWARD
47,BROWARD,111527,MEMORIAL HOSPITAL WEST,428,37,7.96%,465,"MEMORIAL HOSPITAL WEST, Memorial Hospital West, MEMORIAL HOSPITAL WEST",90.00000762939453,25733028.0,BROWARD
48,BROWARD,23960050,MEMORIAL HOSPITAL MIRAMAR,184,14,7.07%,198,"MEMORIAL HOSPITAL MIRAMAR, Memorial Hospital Miramar, MEMORIAL HOSPITAL MIRAMAR",90.00000762939453,25133029.0,BROWARD
49,CALHOUN,100112,CALHOUN-LIBERTY HOSPITAL,7,3,30.00%,10,"CALHOUN-LIBERTY HOSPITAL, Calhoun Liberty Hospital, CALHOUN-LIBERTY HOSPITAL ASSN",90.00000762939453,5032424.0,CALHOUN
50,CHARLOTTE,100047,BAYFRONT HEALTH PUNTA GORDA,161,70,30.30%,231,"BAYFRONT HEALTH PUNTA GORDA, Bayfront Health - Punta Gorda (FKA Charlotte Regional Medical Center), BAYFRONT HEALTH PUNTA GORDA",90.00000762939453,6333950.0,CHARLOTTE
51,CHARLOTTE,100077,BAYFRONT HEALTH PORT CHARLOTTE,160,57,26.27%,217,"BAYFRONT HEALTH PORT CHARLOTTE, Bayfront Health - Port Charlotte (FKA Peace River Regional Medical Center), PEACE RIVER REGIONAL MEDICAL CENTER",90.00000762939453,31433952.0,CHARLOTTE
52,CHARLOTTE,100236,FAWCETT MEMORIAL HOSPITAL,161,92,36.36%,253,"FAWCETT MEMORIAL HOSPITAL, Fawcett Memorial Hospital, FAWCETT MEMORIAL HOSPITAL",90.00000762939453,9533952.0,CHARLOTTE
53,CITRUS,100023,CITRUS MEMORIAL HOSPITAL,165,39,19.12%,204,"CITRUS MEMORIAL HOSPITAL, Citrus Memorial Hospital, CITRUS MEMORIAL HOSPITAL",90.00000762939453,6634452.0,CITRUS
54,CITRUS,100249,BAYFRONT HEALTH SEVEN RIVERS,94,36,27.69%,130,"SEVEN RIVERS REGIONAL MEDICAL CENTER, Bayfront Health - Seven Rivers (FKA Seven Rivers Regional Medical Center), SEVEN RIVERS REGIONAL MEDICAL CENTER",85.50000762939453,34834428.0,CITRUS
55,CLAY,100016,KINDRED HOSPITAL-NORTH FLORIDA,34,23,40.35%,57,"KINDRED HOSPITAL-NORTH FLORIDA, Kindred Hospital - North Florida, ",90.00000762939453,20332043.0,CLAY
56,CLAY,100226,ORANGE PARK MEDICAL CENTER,345,40,10.39%,385,"ORANGE PARK MEDICAL CENTER, Orange Park Medical Center, ORANGE PARK MEDICAL CENTER",90.00000762939453,29232073.0,CLAY
57,CLAY,23960117,ASCENSION ST VINCENT'S CLAY COUNTY,91,15,14.15%,106,"ST. VINCENT'S MEDICAL CENTER CLAY COUNTY, Ascension St Vincents Clay County Hospital, ST. VINCENTS MEDICAL CENTER-CLAY",87.35295104980469,36232068.0,CLAY
58,COLLIER,100018,NAPLES COMMUNITY HOSPITAL,251,45,15.20%,296,"NAPLES COMMUNITY HOSPITAL, NCH Baker Hospital Downtown (FKA NCH Downtown Naples Hospital Campus), NAPLES COMMUNITY HOSPITAL",90.00000762939453,78634102.0,COLLIER
59,COLLIER,110043,"WILLOUGH AT NAPLES, THE",47,36,43.37%,83,"WILLOUGH AT NAPLES HOSPITAL, The Willough at Naples, THE WILLOUGH AT NAPLES",85.50000762939453,43234113.0,COLLIER
60,COLLIER,120006,NCH HEALTHCARE SYSTEM NORTH NAPLES HOSPITAL CAMPUS,240,36,13.04%,276,"NCH HEALTHCARE SYSTEM NORTH NAPLES HOSPITAL CAMPUS, , ",97.08738708496094,27734110.0,COLLIER
61,COLLIER,23960025,PHYSICIANS REGIONAL MEDICAL CENTER - PINE RIDGE,100,5,4.76%,105,"PHYSICIANS REGIONAL - PINE RIDGE, Physicians Regional Medical Center - Pine Ridge, PHYSICIANS REGIONAL MEDICAL CENTER",90.00000762939453,31634119.0,COLLIER
62,COLLIER,23960057,PHYSICIANS REGIONAL MEDICAL CENTER - COLLIER,86,14,14.00%,100,"PHYSICIANS REGIONAL - PINE RIDGE, Physicians Regional Medical Center - Pine Ridge, PHYSICIANS REGIONAL MEDICAL CENTER",85.50000762939453,31634119.0,COLLIER
63,COLLIER,23960116,LANDMARK HOSPITAL OF SOUTHWEST FLORIDA,28,20,41.67%,48,"LANDMARK HOSPITAL OF SOUTHWEST FLORIDA, Landmark Hospital of Southwest Florida, ",90.00000762939453,178334109.0,COLLIER
64,COLUMBIA,100102,SHANDS LAKE SHORE REGIONAL MEDICAL CENTER,12,16,57.14%,28,"SHANDS LAKE SHORE REGIONAL MEDICAL CENTER, Shands Lake Shore Regional Medical Center, SHANDS LAKE SHORE",90.00000762939453,35632055.0,COLUMBIA
65,COLUMBIA,100156,LAKE CITY MEDICAL CENTER,102,0,0.00%,102,"LAKE CITY MEDICAL CENTER, Lake City Medical Center, LAKE CITY MEDICAL CENTER",90.00000762939453,20932055.0,COLUMBIA
66,DESOTO,100175,DESOTO MEMORIAL HOSPITAL,25,30,54.55%,55,"DESOTO MEMORIAL HOSPITAL, Desoto Memorial Hospital, DESOTO MEMORIAL HOSPITAL",90.00000762939453,7434266.0,DESOTO
67,DUVAL,100001,UF HEALTH JACKSONVILLE,497,106,17.58%,603,"UF HEALTH JACKSONVILLE, UF Health Jacksonville, SHANDS JACKSONVILLE MEDICAL CENTER",90.00000762939453,35332209.0,DUVAL
68,DUVAL,100040,ASCENSION ST VINCENT'S RIVERSIDE,372,146,28.19%,518,"SAINT VINCENT'S MEDICAL CENTER RIVERSIDE, Ascension St Vincents Riverside Hospital, ST. VINCENTS MEDICAL CENTER-RIVERSI",87.18750762939453,33432204.0,DUVAL
69,DUVAL,100088,BAPTIST MEDICAL CENTER JACKSONVILLE,497,39,7.28%,536,"BAPTIST MEDICAL CENTER JACKSONVILLE, Baptist Medical Center Jacksonville (FKA BMC Downtown), BAPTIST MEDICAL CENTER",90.00000762939453,1932207.0,DUVAL
70,DUVAL,100117,BAPTIST MEDICAL CENTER - BEACHES,162,33,16.92%,195,"BAPTIST MEDICAL CENTER - BEACHES, Baptist Medical Center Beaches, BAPTIST MEDICAL CENTER-BEACHES",90.00000762939453,1632250.0,DUVAL
71,DUVAL,100151,MAYO CLINIC,301,16,5.05%,317,"MAYO CLINIC, Mayo Clinic Hospital - Florida, MAYO CLINIC FLORIDA",90.00000762939453,24032224.0,DUVAL
72,DUVAL,100179,MEMORIAL HOSPITAL JACKSONVILLE,342,157,31.46%,499,"MEMORIAL HOSPITAL JACKSONVILLE, Memorial Hospital Jacksonville, MEMORIAL HOSPITAL OF JACKSONVILLE",90.00000762939453,25032216.0,DUVAL
73,DUVAL,100184,BROOKS REHABILITATION HOSPITAL,138,1,0.72%,139,"BROOKS REHABILITATION HOSPITAL, Brooks Rehabilitation Hospital, BROOKS REHABILITATION",90.00000762939453,4032216.0,DUVAL
74,DUVAL,100196,CURAHEALTH JACKSONVILLE LLC,20,2,9.09%,22,"SPECIALTY HOSPITAL JACKSONVILLE, CuraHealth - Jacksonville, CURAHEALTH JACKSONVILLE LLC",90.00000762939453,37532207.0,DUVAL
75,DUVAL,104016,RIVER POINT BEHAVIORAL HEALTH,59,25,29.76%,84,"RIVER POINT BEHAVIORAL HEALTH, River Point Behavioral Health, RIVER POINT BEHAVIORAL HEALTH",90.00000762939453,32932216.0,DUVAL
76,DUVAL,23960052,BAPTIST MEDICAL CENTER SOUTH,295,81,21.54%,376,"BAPTIST MEDICAL CENTER SOUTH, , ",94.91526794433594,2132258.0,DUVAL
77,DUVAL,23960061,WEKIVA SPRINGS,67,53,44.17%,120,"WEKIVA SPRINGS, Wekiva Springs Center Hospital, WEKIVA SPRINGS CENTER  LLC",90.00000762939453,41832216.0,DUVAL
78,DUVAL,23960088,ASCENSION ST VINCENT'S SOUTHSIDE,127,116,47.74%,243,"ST VINCENT'S MEDICAL CENTER SOUTHSIDE, Ascension St Vincents Southside Hospital, ST. VINCENTS MEDICAL CENTER SOUTHSID",87.18750762939453,39532216.0,DUVAL
79,DUVAL,23960123,UF HEALTH NORTH,97,0,0.00%,97,"UF HEALTH NORTH, UF Health North, ",90.00000762939453,174932218.0,DUVAL
80,DUVAL,23960157,WOLFSON CHILDREN'S HOSPITAL,157,57,26.64%,214,"WOLFSON CHILDREN'S HOSPITAL - JACKSONVILLE, , ",90.00000762939453,81832207.0,DUVAL
81,ESCAMBIA,100025,ASCENSION SACRED HEART PENSACOLA,372,119,24.24%,491,"SELECT SPECIALTY HOSPITAL PENSACOLA, Select Specialty Hospital - Pensacola, SSH - PENSACOLA INC",85.50000762939453,34632504.0,ESCAMBIA
82,ESCAMBIA,100093,BAPTIST HOSPITAL,283,141,33.25%,424,"BAPTIST HOSPITAL, Baptist Hospital, BAPTIST HOSPITAL",90.00000762939453,1132501.0,ESCAMBIA
83,ESCAMBIA,100231,WEST FLORIDA HOSPITAL,304,109,26.39%,413,"WEST FLORIDA HOSPITAL, West Florida Hospital (AKA West Florida Healthcare), WEST FLORIDA HOSPITAL",90.00000762939453,42232514.0,ESCAMBIA
84,ESCAMBIA,23960076,SELECT SPECIALTY HOSPITAL PENSACOLA,68,7,9.33%,75,"SELECT SPECIALTY HOSPITAL PENSACOLA, Select Specialty Hospital - Pensacola, SSH - PENSACOLA INC",90.00000762939453,34632504.0,ESCAMBIA
85,FLAGLER,100118,ADVENTHEALTH PALM COAST,95,4,4.04%,99,"FLORIDA HOSPITAL FLAGLER, AdventHealth Palm Coast (FKA Florida Hospital Flagler), ADVENTHEALTH PALM COAST",90.00000762939453,12132164.0,FLAGLER
86,FRANKLIN,100153,GEORGE E WEEMS MEMORIAL HOSPITAL,0,15,100.00%,15,"GEORGE E WEEMS MEMORIAL HOSPITAL, George E Weems Memorial Hospital, GEORGE E. WEEMS MEMORIAL HOSPITAL",90.00000762939453,14032329.0,FRANKLIN
87,GADSDEN,100159,"CAPITAL REGIONAL MEDICAL CENTER, GADSDEN MEMORIAL CAMPUS",0,0,,0,"CAPITAL REGIONAL MEDICAL CENTER - GADSDEN MEMORIAL CAMPUS, , ",94.82759857177734,5732353.0,GADSDEN
88,GADSDEN,104000,FLORIDA STATE HOSPITAL,0,0,,0,"FLORIDA STATE HOSPITAL, Florida State Hospital, FLORIDA STATE HOSPITAL",90.00000762939453,13732324.0,GADSDEN
89,GULF,23960084,ASCENSION SACRED HEART GULF,7,14,66.67%,21,"SACRED HEART HOSPITAL ON THE GULF, Ascension Sacred Heart Hospital on the Gulf, SACRED HEART HOSPITAL ON THE GULF",85.50000762939453,33232456.0,GULF
90,HARDEE,100282,ADVENTHEALTH WAUCHULA,25,0,0.00%,25,"FLORIDA HOSPITAL WAUCHULA, , ",53.06123352050781,13433873.0,HARDEE
91,HENDRY,100098,HENDRY REGIONAL MEDICAL CENTER,9,20,68.97%,29,"HENDRY REGIONAL MEDICAL CENTER, Hendry Regional Medical Center, HENDRY REGIONAL MEDICAL CENTER",90.00000762939453,16933440.0,HENDRY
92,HERNANDO,100071,BAYFRONT HEALTH BROOKSVILLE,75,45,37.50%,120,"BAYFRONT HEALTH BROOKSVILLE, Bayfront Health - Brooksville (FKA Brooksville Regional Hospital), BROOKSVILLE REGIONAL HOSPTAL",90.00000762939453,4134601.0,HERNANDO
93,HERNANDO,100264,OAK HILL HOSPITAL,275,75,21.43%,350,"OAK HILL HOSPITAL, Oak Hill Hospital, OAK HILL HOSPITAL",90.00000762939453,28934613.0,HERNANDO
94,HERNANDO,110054,SPRINGBROOK HOSPITAL,74,0,0.00%,74,"SPRINGBROOK HOSPITAL, Springbrook Hospital, SPRINGBROOK HOSPITAL",90.00000762939453,37734609.0,HERNANDO
95,HERNANDO,111525,BAYFRONT HEALTH SPRING HILL,59,65,52.42%,124,"BAYFRONT HEALTH SPRING HILL, , ",94.73685455322266,37634609.0,HERNANDO
96,HERNANDO,23960042,ENCOMPASS HEALTH REHABILITATION HOSPITAL OF SPRING HILL,62,18,22.50%,80,"HEALTHSOUTH REHABILITATION HOSPITAL OF SPRING HILL, Encompass Health Rehabilitation Hospital of Spring Hill (FKA Healthsouth Rehab of Spring Hill), ENCOMPASS HEALTH REHABILITATION HOSP",90.00000762939453,16334613.0,HERNANDO
97,HIGHLANDS,100049,HIGHLANDS REGIONAL MEDICAL CENTER,51,30,37.04%,81,"HIGHLANDS REGIONAL MEDICAL CENTER, Highlands Regional Medical Center, HIGHLANDS REGIONAL MEDICAL CENTER",90.00000762939453,17233870.0,HIGHLANDS
98,HIGHLANDS,100109,ADVENTHEALTH SEBRING,158,13,7.60%,171,"FLORIDA HOSPITAL HEARTLAND MEDICAL CENTER, AdventHealth Sebring (FKA Florida Hospital Heartland Medical Center), ADVENTHEALTH SEBRING",90.00000762939453,12233872.0,HIGHLANDS
99,HIGHLANDS,120013,ADVENTHEALTH LAKE PLACID,16,12,42.86%,28,"FLORIDA HOSPITAL HEARTLAND MEDICAL CENTER AT LAKE PLACID, , ",85.50000762939453,12333852.0,HIGHLANDS
100,HILLSBOROUGH,100069,ADVENTHEALTH CARROLLWOOD,88,3,3.30%,91,"FLORIDA HOSPITAL CARROLLWOOD, AdventHealth Carrollwood (FKA Florida Hospital Carrollwood), ADVENTHEALTH CARROLLWOOD",90.00000762939453,11133614.0,HILLSBOROUGH
101,HILLSBOROUGH,100075,ST JOSEPHS HOSPITAL,625,64,9.29%,689,"FLORIDA HOSPITAL CARROLLWOOD, AdventHealth Carrollwood (FKA Florida Hospital Carrollwood), ADVENTHEALTH CARROLLWOOD",85.50000762939453,11133614.0,HILLSBOROUGH
102,HILLSBOROUGH,100115,KINDRED HOSPITAL-BAY AREA-TAMPA,56,17,23.29%,73,"KINDRED HOSPITAL-BAY AREA-TAMPA, Kindred Hospital - Bay Area Tampa, ",90.00000762939453,20133611.0,HILLSBOROUGH
103,HILLSBOROUGH,100128,TAMPA GENERAL HOSPITAL,875,160,15.46%,1035,"TAMPA GENERAL HOSPITAL, Tampa General Hospital, TAMPA GENERAL HOSPITAL",90.00000762939453,39833606.0,HILLSBOROUGH
104,HILLSBOROUGH,100132,SOUTH FLORIDA BAPTIST HOSPITAL,102,3,2.86%,105,"SOUTH FLORIDA BAPTIST HOSPITAL, South Florida Baptist Hospital, SOUTH FLORIDA BAPTIST HOSPITAL",90.00000762939453,36433563.0,HILLSBOROUGH
105,HILLSBOROUGH,100143,KINDRED HOSPITAL-CENTRAL TAMPA,74,25,25.25%,99,"KINDRED HOSPITAL-CENTRAL TAMPA, Kindred Hospital - Central Tampa, ",90.00000762939453,20233603.0,HILLSBOROUGH
106,HILLSBOROUGH,100173,ADVENTHEALTH TAMPA,454,82,15.30%,536,"FLORIDA HOSPITAL TAMPA, AdventHealth Tampa (FKA Florida Hospital Tampa), ADVENTHEALTH TAMPA - AMENDED",90.00000762939453,13233613.0,HILLSBOROUGH
107,HILLSBOROUGH,100206,MEMORIAL HOSPITAL OF TAMPA,93,12,11.43%,105,"MEMORIAL HOSPITAL OF TAMPA, Memorial Hospital of Tampa (FKA IASIS Memorial Hospital of Tampa), MEMORIAL HOSPITAL OF TAMPA",90.00000762939453,25233609.0,HILLSBOROUGH
108,HILLSBOROUGH,100243,BRANDON REGIONAL HOSPITAL,356,138,27.94%,494,"BRANDON REGIONAL HOSPITAL, Brandon Regional Hospital, BRANDON REGIONAL HOSPITAL",90.00000762939453,3833511.0,HILLSBOROUGH
109,HILLSBOROUGH,100255,TAMPA COMMUNITY HOSPITAL- A CAMPUS OF MEMORIAL HOSPITAL OF TAMPA,25,9,26.47%,34,"FLORIDA HOSPITAL CARROLLWOOD, AdventHealth Carrollwood (FKA Florida Hospital Carrollwood), ADVENTHEALTH CARROLLWOOD",85.50000762939453,11133614.0,HILLSBOROUGH
110,HILLSBOROUGH,100259,SOUTH BAY HOSPITAL,53,74,58.27%,127,"SOUTH BAY HOSPITAL, South Bay Hospital, ",90.00000762939453,36233573.0,HILLSBOROUGH
111,HILLSBOROUGH,110009,H LEE MOFFITT CANCER CENTER & RESEARCH INSTITUTE HOSPITAL,218,35,13.83%,253,"FLORIDA HOSPITAL CARROLLWOOD, AdventHealth Carrollwood (FKA Florida Hospital Carrollwood), ADVENTHEALTH CARROLLWOOD",85.50000762939453,11133614.0,HILLSBOROUGH
112,HILLSBOROUGH,23960100,ST JOSEPHS HOSPITAL NORTH,114,3,2.56%,117,"ST JOSEPH'S HOSPITAL NORTH, , ",92.59260559082031,38833558.0,HILLSBOROUGH
113,HILLSBOROUGH,23960105,ST JOSEPHS HOSPITAL SOUTH,150,10,6.25%,160,"ST. JOSEPH'S HOSPITAL SOUTH, , ",90.90910339355469,36533578.0,HILLSBOROUGH
114,HILLSBOROUGH,23960113,ST JOSEPHS HOSPITAL BEHAVIORAL HEALTH CENTER,51,9,15.00%,60,"ST JOSEPH'S HOSPITAL BEHAVIORAL HEALTH CENTER, St Josephs Hospital Behavioral Health Center, ",87.95455169677734,38733607.0,HILLSBOROUGH
115,HOLMES,100078,DOCTORS MEMORIAL HOSPITAL,12,8,40.00%,20,"DOCTORS MEMORIAL HOSPITAL, Doctors Memorial Hospital, DOCTORS MEMORIAL HOSPITAL",90.00000762939453,8132425.0,HOLMES
116,INDIAN RIVER,100105,CLEVELAND CLINIC INDIAN RIVER HOSPITAL,201,110,35.37%,311,"INDIAN RIVER MEDICAL CENTER, Cleveland Clinic Indian River Hospital (FKA Indian River Medical Center), INDIAN RIVER MEMORIAL HOSPITA.L",90.00000762939453,17932960.0,INDIAN RIVER
117,INDIAN RIVER,100217,STEWARD SEBASTIAN RIVER MEDICAL CENTER,90,19,17.43%,109,"INDIAN RIVER MEDICAL CENTER, Cleveland Clinic Indian River Hospital (FKA Indian River Medical Center), INDIAN RIVER MEMORIAL HOSPITA.L",85.50000762939453,17932960.0,INDIAN RIVER
118,INDIAN RIVER,110017,ENCOMPASS HEALTH REHABILITATION HOSPITAL OF TREASURE COAST,39,26,40.00%,65,"HEALTHSOUTH TREASURE COAST REHABILITATION, Encompass Health Rehabilitation Hospital of Treasure Coast (FKA Healthsouth of Treasure Coast), ENCOMPASS HEALTH REHABILITATION HOSP",90.00000762939453,16732960.0,INDIAN RIVER
119,JACKSON,100138,CAMPBELLTON-GRACEVILLE HOSPITAL,0,0,,0,"CAMPBELLTON-GRACEVILLE HOSPITAL, , ",95.38462829589844,5232440.0,JACKSON
120,JACKSON,100142,JACKSON HOSPITAL,72,19,20.88%,91,"JACKSON HOSPITAL, Jackson Hospital, JACKSON HOSPITAL  MARIANNA",90.00000762939453,18032446.0,JACKSON
121,LAKE,100051,ORLANDO HEALTH SOUTH LAKE HOSPITAL,210,15,6.67%,225,"SOUTH LAKE HOSPITAL, Orlando Health South Lake Hospital, SOUTH LAKE HOSPITAL",90.00000762939453,36834711.0,LAKE
122,LAKE,100057,ADVENTHEALTH WATERMAN,240,60,20.00%,300,"FLORIDA HOSPITAL WATERMAN, AdventHealth Waterman (FKA Florida Hospital Waterman), FLORIDA HOSPTIAL WATERMAN",90.00000762939453,13332778.0,LAKE
123,LAKE,100084,UF HEALTH LEESBURG HOSPITAL,252,80,24.10%,332,"LEESBURG REGIONAL MEDICAL CENTER, UF Health Leesburg Hospital (FKA Leesburg Regional Medical Center), LEESBURG REGIONAL MEDICAL CENTER",90.00000762939453,22434748.0,LAKE
124,LAKE,100214,UF HEALTH LEESBURG SENIOR BEHAVIORAL HEALTH CENTER,6,15,71.43%,21,"LEESBURG REGIONAL MEDICAL CENTER, UF Health Leesburg Hospital (FKA Leesburg Regional Medical Center), LEESBURG REGIONAL MEDICAL CENTER",85.50000762939453,22434748.0,LAKE
125,LAKE,104018,LIFESTREAM BEHAVIORAL CENTER,44,2,4.35%,46,"LIFESTREAM BEHAVIORAL CENTER, LifeStream Behavioral Center, LIFESTREAM BEHAVIORAL CENTER",90.00000762939453,22834748.0,LAKE
126,LEE,100012,LEE MEMORIAL HOSPITAL,290,49,14.45%,339,"LEE MEMORIAL HOSPITAL, Lee Memorial Hospital, LEE MEMORIAL HOSPITAL",90.00000762939453,22233901.0,LEE
127,LEE,100107,LEHIGH REGIONAL MEDICAL CENTER,31,12,27.91%,43,"LEHIGH REGIONAL MEDICAL CENTER, Lehigh Regional Medical Center, LEHIGH REGIONAL",90.00000762939453,22733936.0,LEE
128,LEE,100220,GULF COAST MEDICAL CENTER LEE MEMORIAL HEALTH SYSTEM,407,55,11.90%,462,"GULF COAST MEDICAL CENTER LEE MEMORIAL H, Gulf Coast Medical Center, GULF COAST MEDICAL CENTER",85.50000762939453,14833912.0,LEE
129,LEE,100244,CAPE CORAL HOSPITAL,263,23,8.04%,286,"CAPE CORAL HOSPITAL, Cape Coral Hospital, CAPE CORAL HOSPITAL",90.00000762939453,5533990.0,LEE
130,LEE,120005,HEALTHPARK MEDICAL CENTER,365,84,18.71%,449,"HEALTHPARK MEDICAL CENTER, , ",94.33963012695312,15833908.0,LEE
